year,code,domain
2014,160903,"Програми в галузі сільського господарства, лісового господарства, рибальства та мисливства"
2014,170901,"Національна програма інформатизації"
2014,070807,"Інші освітні програми"
2014,090802,"Інші програми соціального захисту дітей"
2014,091102,"Програми i заходи центрiв соцiальних служб для сім`ї, дітей та молодi"
2014,091103,"Соціальні програми i заходи державних органiв у справах молоді"
2014,091104,"Соціальні програми і заходи державних органів з питань забезпечення рівних прав та можливостей жінок і чоловіків"
